{
  "$schema": "http://json-schema.org/draft-07/schema#",
  "$id": "https://mamba.cclab.dev/validation/schemas/release_summary.schema.json",
  "title": "Mamba MVP release-gate summary",
  "description": "Stable JSON schema for release-gate summaries emitted by the MVP release runner (#2821). Closes #2820 / parent #2775. The schema lives next to the per-profile manifests under apps/mamba/validation/ so workers can resolve both from one root.",
  "type": "object",
  "additionalProperties": false,
  "required": [
    "schema_version",
    "release_id",
    "generated_at",
    "runtime_identity",
    "overall",
    "profiles",
    "blockers_by_objective",
    "artifacts"
  ],
  "properties": {
    "schema_version": {
      "type": "integer",
      "minimum": 1,
      "description": "Major version of this schema. Bump only on breaking changes; workers MUST refuse summaries with an unknown major."
    },
    "release_id": {
      "type": "string",
      "minLength": 1,
      "description": "Stable identifier for this release attempt — typically a commit SHA or mamba version tag."
    },
    "generated_at": {
      "type": "string",
      "format": "date-time",
      "description": "RFC 3339 timestamp when the summary was produced."
    },
    "runtime_identity": {
      "type": "object",
      "required": ["cpython", "mamba_edition"],
      "additionalProperties": false,
      "properties": {
        "cpython": {
          "type": "string",
          "description": "CPython major.minor as reported by `python3 -V`. The performance profile fails this entire summary if the value does not match `[runtime_identity].required_cpython` in performance.toml."
        },
        "mamba_edition": {
          "type": "string",
          "description": "Mamba runtime edition tag — must match `[runtime_identity].required_mamba_edition` in performance.toml."
        }
      }
    },
    "overall": {
      "type": "object",
      "required": ["pass", "blocking_failure_count", "release_required_profiles", "report_only_profiles"],
      "additionalProperties": false,
      "properties": {
        "pass": {
          "type": "boolean",
          "description": "True iff every release-required profile passed and no blocker is unresolved."
        },
        "blocking_failure_count": {
          "type": "integer",
          "minimum": 0,
          "description": "Number of failures across release-required profiles. A non-zero value MUST set `pass` to false."
        },
        "release_required_profiles": {
          "type": "array",
          "items": {"type": "string"},
          "description": "Profile ids whose failure blocks the release (e.g. smoke, correctness, performance, ecosystem, package_manager, mambalibs)."
        },
        "report_only_profiles": {
          "type": "array",
          "items": {"type": "string"},
          "description": "Profile ids whose failure is reported but never blocks."
        }
      }
    },
    "profiles": {
      "type": "object",
      "minProperties": 1,
      "description": "Per-profile rollup keyed by profile id (matches the file stem under apps/mamba/validation/profiles/).",
      "additionalProperties": {
        "type": "object",
        "required": [
          "profile",
          "command",
          "status",
          "blocking",
          "counts"
        ],
        "additionalProperties": true,
        "properties": {
          "profile": {
            "type": "string",
            "description": "Profile id; must equal the parent key."
          },
          "command": {
            "type": "string",
            "description": "Shell command the runner invoked for this profile."
          },
          "status": {
            "type": "string",
            "enum": ["pass", "fail", "skip"],
            "description": "Profile-level outcome. `skip` is only legal for report-only profiles."
          },
          "blocking": {
            "type": "boolean",
            "description": "True iff this profile is release-required."
          },
          "counts": {
            "type": "object",
            "required": ["passed", "failed", "missing"],
            "additionalProperties": true,
            "properties": {
              "passed": {"type": "integer", "minimum": 0},
              "failed": {"type": "integer", "minimum": 0},
              "missing": {"type": "integer", "minimum": 0},
              "skipped": {"type": "integer", "minimum": 0},
              "xfail": {"type": "integer", "minimum": 0},
              "stub": {"type": "integer", "minimum": 0},
              "import_pass": {"type": "integer", "minimum": 0},
              "silent_pass": {"type": "integer", "minimum": 0}
            }
          }
        }
      }
    },
    "blockers_by_objective": {
      "type": "object",
      "description": "Acceptance: \"Summary groups blockers by MVP objective.\" Keys are MVP objective ids (smoke, correctness, performance, ecosystem, package_manager, mambalibs, release_gate); values are arrays of blocker entries surfacing the failing fixture, profile, and tracking issue.",
      "minProperties": 0,
      "additionalProperties": {
        "type": "array",
        "items": {
          "type": "object",
          "required": ["profile", "fixture_id", "kind", "reason"],
          "additionalProperties": true,
          "properties": {
            "profile": {"type": "string"},
            "fixture_id": {"type": "string"},
            "kind": {
              "type": "string",
              "enum": [
                "failed",
                "missing",
                "silent_pass",
                "build_then_import_mismatch",
                "policy_violation"
              ]
            },
            "reason": {"type": "string"},
            "tracking_issue": {
              "type": ["string", "null"],
              "description": "GitHub issue number or url; null when there is no tracker yet."
            }
          }
        }
      }
    },
    "artifacts": {
      "type": "object",
      "required": ["summary_path"],
      "additionalProperties": true,
      "properties": {
        "summary_path": {
          "type": "string",
          "description": "Filesystem path of this very summary file once written."
        },
        "logs_path": {"type": ["string", "null"]},
        "baseline_path": {"type": ["string", "null"]},
        "lockfile_path": {"type": ["string", "null"]},
        "environment_path": {"type": ["string", "null"]},
        "project_path": {"type": ["string", "null"]}
      }
    }
  }
}
