{
  "schema_version": 1,
  "release_id": "mamba-v0.3.60-mvp-dryrun",
  "generated_at": "2026-05-20T00:00:00Z",
  "runtime_identity": {
    "cpython": "3.12",
    "mamba_edition": "py312"
  },
  "overall": {
    "pass": false,
    "blocking_failure_count": 1,
    "release_required_profiles": [
      "smoke",
      "correctness",
      "performance",
      "ecosystem",
      "package_manager",
      "mambalibs"
    ],
    "report_only_profiles": []
  },
  "profiles": {
    "smoke": {
      "profile": "smoke",
      "command": "python3 scripts/gate0_list_tests.py --json",
      "status": "pass",
      "blocking": true,
      "counts": {"passed": 3, "failed": 0, "missing": 0}
    },
    "correctness": {
      "profile": "correctness",
      "command": "cargo test -p mamba --tests --quiet",
      "status": "pass",
      "blocking": true,
      "counts": {"passed": 220, "failed": 0, "missing": 0, "skipped": 0, "xfail": 4, "stub": 2, "import_pass": 8}
    },
    "performance": {
      "profile": "performance",
      "command": "cargo bench --bench cross_runtime -- --json",
      "status": "fail",
      "blocking": true,
      "counts": {"passed": 2, "failed": 6, "missing": 0}
    },
    "ecosystem": {
      "profile": "ecosystem",
      "command": "cargo test -p mamba --test conformance_real_world",
      "status": "pass",
      "blocking": true,
      "counts": {"passed": 28, "failed": 0, "missing": 0, "xfail": 3}
    },
    "package_manager": {
      "profile": "package_manager",
      "command": "cargo test -p mamba --test pkgmgr_workflows",
      "status": "pass",
      "blocking": true,
      "counts": {"passed": 8, "failed": 0, "missing": 0}
    },
    "mambalibs": {
      "profile": "mambalibs",
      "command": "cargo test -p mamba --test mambalibs_pipeline",
      "status": "pass",
      "blocking": true,
      "counts": {"passed": 12, "failed": 0, "missing": 0, "silent_pass": 0}
    }
  },
  "blockers_by_objective": {
    "performance": [
      {
        "profile": "performance",
        "fixture_id": "fib_recursive",
        "kind": "failed",
        "reason": "speedup 0.518x below per-benchmark floor 1.0x",
        "tracking_issue": "#2096"
      }
    ]
  },
  "artifacts": {
    "summary_path": "/tmp/mamba/release/mvp-dryrun.summary.json",
    "logs_path": "/tmp/mamba/release/mvp-dryrun.logs.tar.zst",
    "baseline_path": "apps/mamba/baseline.json",
    "lockfile_path": null,
    "environment_path": null,
    "project_path": null
  }
}
